{
  "$schema": "https://json-schema.org/draft/2020-12/schema",
  "$id": "https://voyascope.local/schema/event.schema.json",
  "title": "予定（打ち上げ・到着などの出来事）",
  "$comment": "日付は運用機関の公式発表どおりに書く。遅れたら status を postponed にし、新しい日付が公式に出たら when を直す。推測で日付を書かない。",
  "type": "object",
  "required": ["id", "kind", "regions", "title", "when", "links", "updated_at"],
  "additionalProperties": false,
  "properties": {
    "id": { "$ref": "common.schema.json#/$defs/id" },
    "kind": {
      "enum": ["launch", "arrival", "separation", "flyby", "milestone", "meteor"],
      "description": "launch=打ち上げ / arrival=到着 / separation=分離 / flyby=接近（スイングバイ・フライバイ） / milestone=節目 / meteor=流星群の極大"
    },
    "regions": {
      "type": "array",
      "minItems": 1,
      "uniqueItems": true,
      "items": { "enum": ["japan", "world"] },
      "description": "日本の機関が関わる出来事は japan。世界の出来事は world（両方でもよい）"
    },
    "title": { "$ref": "common.schema.json#/$defs/bilingualName" },
    "summary": {
      "$ref": "common.schema.json#/$defs/fact",
      "description": "一言の説明。出典に書かれていることだけ"
    },
    "when": {
      "type": "object",
      "required": ["value", "source", "as_of"],
      "additionalProperties": false,
      "description": "公式に発表された日時。as_of は出典を確かめた日",
      "properties": {
        "value": { "$ref": "#/$defs/when" },
        "source": { "$ref": "common.schema.json#/$defs/source" },
        "as_of": { "$ref": "common.schema.json#/$defs/date" },
        "note": { "type": "string", "maxLength": 80 }
      }
    },
    "status": {
      "description": "なければ予定どおり（scheduled）。延期・終わった・中止は、公式の発表を出典にして書く",
      "allOf": [
        { "$ref": "common.schema.json#/$defs/fact" },
        {
          "if": { "required": ["value"] },
          "then": { "properties": { "value": { "enum": ["scheduled", "postponed", "done", "cancelled"] } } }
        }
      ]
    },
    "window_end": {
      "description": "打ち上げの予備期間の終わり（日本時間の日付）",
      "allOf": [
        { "$ref": "common.schema.json#/$defs/fact" },
        {
          "if": { "required": ["value"] },
          "then": { "properties": { "value": { "$ref": "common.schema.json#/$defs/date" } } }
        }
      ]
    },
    "vehicle": { "$ref": "common.schema.json#/$defs/fact" },
    "site": {
      "type": "object",
      "required": ["label", "name", "position"],
      "additionalProperties": false,
      "description": "射場。地球の上にピンを立てる",
      "properties": {
        "label": { "type": "string", "minLength": 1, "maxLength": 8, "description": "ピンに添える短い名前" },
        "name": { "$ref": "common.schema.json#/$defs/fact" },
        "position": {
          "allOf": [
            { "$ref": "common.schema.json#/$defs/fact" },
            {
              "if": { "required": ["value"] },
              "then": {
                "properties": {
                  "value": {
                    "type": "object",
                    "required": ["lat", "lng"],
                    "additionalProperties": false,
                    "properties": {
                      "lat": { "type": "number", "minimum": -90, "maximum": 90 },
                      "lng": { "type": "number", "minimum": -180, "maximum": 180 }
                    }
                  }
                }
              }
            }
          ]
        }
      }
    },
    "when_label": {
      "enum": ["極大", "見ごろ"],
      "description": "流星群の when が何の日時か。なければ「極大」。公式が極大の日時を出さず、見ごろだけを書いているときは「見ごろ」"
    },
    "rate": {
      "$ref": "common.schema.json#/$defs/fact",
      "description": "流星群の1時間あたりの数の目安。必ず条件（「空の暗い場所で」など）と一緒に、出典の書き方どおり"
    },
    "active": {
      "description": "流星群の出現期間（日本時間の日付 from〜to）。地球のまわりのちりは、このあいだだけ描く",
      "allOf": [
        { "$ref": "common.schema.json#/$defs/fact" },
        {
          "if": { "required": ["value"] },
          "then": {
            "properties": {
              "value": {
                "type": "object",
                "required": ["from", "to"],
                "additionalProperties": false,
                "properties": { "from": { "$ref": "common.schema.json#/$defs/date" }, "to": { "$ref": "common.schema.json#/$defs/date" } }
              }
            }
          }
        }
      ]
    },
    "parent": {
      "type": "object",
      "required": ["name"],
      "additionalProperties": false,
      "description": "流星群の母天体。orbit は太陽のまわりの図に使う軌道要素（JPL SBDB など）",
      "properties": {
        "name": { "$ref": "common.schema.json#/$defs/fact" },
        "orbit": {
          "allOf": [
            { "$ref": "common.schema.json#/$defs/fact" },
            {
              "if": { "required": ["value"] },
              "then": {
                "properties": {
                  "value": {
                    "type": "object",
                    "required": ["e", "q", "i", "om", "w"],
                    "additionalProperties": false,
                    "properties": {
                      "e": { "type": "number", "minimum": 0, "exclusiveMaximum": 1 },
                      "a": { "type": "number" },
                      "q": { "type": "number", "exclusiveMinimum": 0 },
                      "i": { "type": "number" },
                      "om": { "type": "number" },
                      "w": { "type": "number" },
                      "tp": { "type": "number" },
                      "epoch": { "type": "number" }
                    }
                  }
                }
              }
            }
          ]
        },
        "moid": { "$ref": "common.schema.json#/$defs/fact" }
      }
    },
    "constellation": {
      "type": "object",
      "required": ["name", "stars"],
      "additionalProperties": false,
      "description": "放射点のある星座の主な星（星の図に使う）。lines は stars の番号どうしを結ぶ線（星座線はイメージ）",
      "properties": {
        "name": { "type": "string", "maxLength": 16 },
        "stars": {
          "allOf": [
            { "$ref": "common.schema.json#/$defs/fact" },
            {
              "if": { "required": ["value"] },
              "then": {
                "properties": {
                  "value": {
                    "type": "array",
                    "items": {
                      "type": "object",
                      "required": ["name", "ra", "dec", "mag"],
                      "additionalProperties": false,
                      "properties": {
                        "name": { "type": "string", "maxLength": 20 },
                        "ra": { "type": "number", "minimum": 0, "maximum": 360 },
                        "dec": { "type": "number", "minimum": -90, "maximum": 90 },
                        "mag": { "type": "number" }
                      }
                    }
                  }
                }
              }
            }
          ]
        },
        "lines": { "type": "array", "items": { "type": "array", "minItems": 2, "maxItems": 2, "items": { "type": "integer", "minimum": 0 } } }
      }
    },
    "radiant": {
      "description": "流星群の放射点（赤経・赤緯、度。J2000）。kind が meteor のときだけ。今夜の方角・高さはアプリが計算する",
      "allOf": [
        { "$ref": "common.schema.json#/$defs/fact" },
        {
          "if": { "required": ["value"] },
          "then": {
            "properties": {
              "value": {
                "type": "object",
                "required": ["ra", "dec"],
                "additionalProperties": false,
                "properties": {
                  "ra": { "type": "number", "minimum": 0, "maximum": 360 },
                  "dec": { "type": "number", "minimum": -90, "maximum": 90 }
                }
              }
            }
          }
        }
      ]
    },
    "links": {
      "type": "array",
      "minItems": 1,
      "maxItems": 3,
      "items": { "$ref": "common.schema.json#/$defs/link" }
    },
    "greeting": { "$ref": "common.schema.json#/$defs/greeting" },
    "updated_at": { "$ref": "common.schema.json#/$defs/date" }
  },
  "dependentSchemas": {
    "greeting": {
      "$comment": "お知らせは、打ち上げ（「いってらっしゃい」）か節目で、公式に終わった（status が done）ものだけ。打ち上げは呼びかける名前が要る。絵は節目のときだけ",
      "required": ["status"],
      "properties": {
        "kind": { "enum": ["launch", "milestone"] },
        "status": { "required": ["value"], "properties": { "value": { "const": "done" } } }
      },
      "if": { "properties": { "kind": { "const": "launch" } } },
      "then": { "properties": { "greeting": { "required": ["name"], "not": { "required": ["image"] } } } }
    },
    "radiant": { "properties": { "kind": { "const": "meteor" } } }
  },
  "$defs": {
    "when": {
      "description": "発表の細かさに合わせて1つだけ：at=時刻まで（UTC）／date=日付だけ／from・to=日付の幅／month=月だけ",
      "oneOf": [
        {
          "type": "object",
          "required": ["at"],
          "additionalProperties": false,
          "properties": { "at": { "type": "string", "pattern": "^\\d{4}-\\d{2}-\\d{2}T\\d{2}:\\d{2}(:\\d{2})?Z$" } }
        },
        {
          "type": "object",
          "required": ["date"],
          "additionalProperties": false,
          "properties": { "date": { "$ref": "common.schema.json#/$defs/date" } }
        },
        {
          "type": "object",
          "required": ["from", "to"],
          "additionalProperties": false,
          "properties": {
            "from": { "$ref": "common.schema.json#/$defs/date" },
            "to": { "$ref": "common.schema.json#/$defs/date" }
          }
        },
        {
          "type": "object",
          "required": ["month"],
          "additionalProperties": false,
          "properties": { "month": { "type": "string", "pattern": "^\\d{4}-(0[1-9]|1[0-2])$" } }
        }
      ]
    }
  }
}
