{
  "id": "leonids-2026",
  "kind": "meteor",
  "regions": [
    "world"
  ],
  "title": {
    "ja": "しし座流星群",
    "en": "Leonids"
  },
  "summary": {
    "value": "テンペル・タットル彗星（55P/Tempel-Tuttle）が母天体の流星群",
    "source": "https://www.nao.ac.jp/astro/basic/major-meteor-shower.html",
    "as_of": "2026-10-25",
    "note": "国立天文台「主な流星群」"
  },
  "when": {
    "value": {
      "date": "2026-11-18"
    },
    "source": "https://www.nao.ac.jp/astro/sky/2026/11.html",
    "as_of": "2026-10-25",
    "note": "国立天文台「ほしぞら情報」2026年11月：18日9時頃に極大（日本では昼。見ごろは18日未明）"
  },
  "when_label": "極大",
  "active": {
    "value": {
      "from": "2026-11-06",
      "to": "2026-11-30"
    },
    "source": "https://www.nao.ac.jp/astro/basic/major-meteor-shower.html",
    "as_of": "2026-10-25",
    "note": "国立天文台の表「流星出現期間」11月6日 - 11月30日（毎年の目安）"
  },
  "rate": {
    "value": "見ごろは11月18日未明。1時間に5個程度。月の条件はよい",
    "source": "https://www.nao.ac.jp/astro/sky/2026/11.html",
    "as_of": "2026-10-25",
    "note": "国立天文台「ほしぞら情報」2026年11月。街明かりの中や見ごろでない時期には数分の1になることがある"
  },
  "radiant": {
    "value": {
      "ra": 154.4,
      "dec": 21.4
    },
    "source": "https://www.ta3.sk/IAUC22DB/MDC2022/Roje/pojedynczy_obiekt.php?kodstrumienia=00013",
    "as_of": "2026-10-26",
    "note": "IAU 流星データセンター（00013 LEO）。Jenniskens 2023 の値（太陽黄経 236.3° のとき）"
  },
  "parent": {
    "name": {
      "value": "テンペル・タットル彗星（55P/Tempel-Tuttle）",
      "source": "https://www.nao.ac.jp/astro/basic/major-meteor-shower.html",
      "as_of": "2026-10-25",
      "note": "国立天文台「主な流星群」"
    },
    "orbit": {
      "value": {
        "e": 0.905552720972412,
        "a": 10.3383382297577,
        "q": 0.976427915467506,
        "i": 162.486575379434,
        "om": 235.270989149082,
        "w": 172.5002736828059,
        "tp": 2450872.5977341123,
        "epoch": 2451040.5
      },
      "source": "https://ssd-api.jpl.nasa.gov/sbdb.api?sstr=55P&full-prec=1",
      "as_of": "2026-10-25",
      "note": "JPL SBDB（解 2002-01-03・元期 1998-08-15 TDB）。角度は度、a・q は au、tp・epoch はユリウス日"
    }
  },
  "links": [
    {
      "label": "国立天文台 ほしぞら情報（2026年11月）",
      "url": "https://www.nao.ac.jp/astro/sky/2026/11.html"
    },
    {
      "label": "国立天文台 主な流星群",
      "url": "https://www.nao.ac.jp/astro/basic/major-meteor-shower.html"
    }
  ],
  "updated_at": "2026-10-26"
}
