{
  "id": "geminids-2026",
  "kind": "meteor",
  "regions": [
    "world"
  ],
  "title": {
    "ja": "ふたご座流星群",
    "en": "Geminids"
  },
  "summary": {
    "value": "フェートン（3200 Phaethon）が母天体の流星群",
    "source": "https://www.nao.ac.jp/astro/basic/geminid.html",
    "as_of": "2026-10-25",
    "note": "国立天文台「ふたご座流星群」。ファエトンとも呼ばれる"
  },
  "when": {
    "value": {
      "date": "2026-12-14"
    },
    "source": "https://www.nao.ac.jp/astro/sky/2026/12.html",
    "as_of": "2026-10-25",
    "note": "国立天文台「ほしぞら情報」2026年12月：14日23時頃に極大（見ごろは14日深夜から15日未明）"
  },
  "when_label": "極大",
  "active": {
    "value": {
      "from": "2026-12-04",
      "to": "2026-12-20"
    },
    "source": "https://www.nao.ac.jp/astro/basic/major-meteor-shower.html",
    "as_of": "2026-10-25",
    "note": "国立天文台の表「流星出現期間」12月4日 - 12月20日（毎年の目安）"
  },
  "rate": {
    "value": "いちばん多いのは15日0時から2時ごろで、空の暗い場所で1時間におよそ60個（東京付近）。14日の夜の月は21時ごろまでに沈み、そのあとは月明かりの影響がない",
    "source": "https://www.nao.ac.jp/astro/sky/2026/12-topics02.html",
    "as_of": "2026-10-25",
    "note": "国立天文台「ふたご座流星群が極大（2026年12月）」。街明かりの中や極大でない時期には何分の1かに減ることがある"
  },
  "radiant": {
    "value": {
      "ra": 113.0,
      "dec": 32.4
    },
    "source": "https://www.ta3.sk/IAUC22DB/MDC2022/Roje/pojedynczy_obiekt.php?kodstrumienia=00004",
    "as_of": "2026-10-26",
    "note": "IAU 流星データセンター（00004 GEM）。Jenniskens 2023 の値（太陽黄経 261.6° のとき）"
  },
  "parent": {
    "name": {
      "value": "フェートン（3200 Phaethon）",
      "source": "https://www.nao.ac.jp/astro/basic/geminid.html",
      "as_of": "2026-10-25",
      "note": "国立天文台「ふたご座流星群」"
    },
    "orbit": {
      "value": {
        "e": 0.8896722828573749,
        "a": 1.271464620523137,
        "q": 0.1402777890099319,
        "i": 22.31052711980998,
        "om": 265.0988062133997,
        "w": 322.3001681112702,
        "tp": 2461285.616437578,
        "epoch": 2461200.5
      },
      "source": "https://ssd-api.jpl.nasa.gov/sbdb.api?sstr=3200&full-prec=1",
      "as_of": "2026-10-25",
      "note": "JPL SBDB（解 2026-10-24・元期 2026-06-09 TDB）。角度は度、a・q は au、tp・epoch はユリウス日"
    }
  },
  "links": [
    {
      "label": "国立天文台 ふたご座流星群が極大（2026年12月）",
      "url": "https://www.nao.ac.jp/astro/sky/2026/12-topics02.html"
    },
    {
      "label": "国立天文台 ふたご座流星群",
      "url": "https://www.nao.ac.jp/astro/basic/geminid.html"
    },
    {
      "label": "国立天文台 主な流星群",
      "url": "https://www.nao.ac.jp/astro/basic/major-meteor-shower.html"
    }
  ],
  "updated_at": "2026-10-26"
}
